質問,回答
投入してもいいのはどんなものですか？,本装置は、有機物を含む多種多様な廃棄物を処理することが可能です。通常の廃棄物処理と異なり、細かい分別は必要ありません。ただし、処理の効率を高めるため、含水率や廃棄物のサイズに応じた簡単な前処理が推奨される場合があります。一般家庭や事業所から排出される日常的な有機廃棄物、含水率（60%ほど）の生ごみや家畜排せつ物、感染性廃棄物（使用済みおむつ、ガーゼ、ダイアライザーなど）が処理可能です。
投入の手順を教えてください,まず、投入口を開あけて廃棄物を投入します。この際無機物などが混入していないことを必ず確認してください。 廃棄物を投入出来たら投入口の閉めてダンパーを開き、炉内に廃棄物を投入します。左右でわかれているので片方ずつ開閉を繰り返してください。もし廃棄物が炉内に投入されたことを確認する際はダンパーを完全に閉じてから投入口を開けて確認してください。
遠赤外線電子熱分解装置（LRAD）の原理は？,炉底に敷き詰めたセラミクス粉末を、下面よりヒータｰで加熱すると遠赤外線が発生します。そこに廃棄物を投入するとセラミクスからの遠赤外線を受け投入物は熱分解（有機化合物を低酸素状態で加熱することによって行われる化学反応）されます。最終的には有機物（投入物）は限界まで分解され、純度の高い無機パウダーとなります。
電子（マイナスイオン）の役割は？,電子（マイナスイオン）は、酸素分子を活性化させ、反応性の高い活性酸素を生成する役割を担います。この活性酸素は熱分解反応を促進し、効率的な分解を可能にすることで、反応中の熱低下を抑える効果もあります。そのため、電子の供給は安定した熱分解プロセスの維持に重要な役割を果たしています。
処理できないものは？,無機物（石、ガラス、鉄等、金属、水、アルミニウム）等です。また、有毒ガスを発生する恐れのある物質（塩素系・フッ素系・PCBなど）や放射性物質、化学薬品、スプレー缶などは絶対に投入しないでください。
運転に必要な人員やスキルは？,装置の運転に特別な資格や高度なスキルは必要ありません。基本的な操作は自動化されており、処理物を所定の手順で投入するだけで処理が可能です。日常的な操作はシンプルで、特別な技術的対応を求められることはありません。なお、定期点検やメンテナンスは専門業者が実施いたしますので、運用負担も最小限に抑えられています。
1日に処理できる量はどのくらいですか？,"1日に最大3立方メートル（㎥） の処理が可能です。
これは 家庭用ごみ袋（45リットル）で約66袋分に相当します。ただし、処理するものの種類によってかさ比重（密度）が異なるため、実際の処理量や処理時間には差が出る場合があります。あくまでおおよその目安としてお考えください。"
